{"artifacts":[{"artifact_type":"cmd_public_projection","byte_length":2464,"filename":"record.json","logical_name":"HGD CMD-001 public CMD projection","mime_type":"application/json","schema":"hgd.cmd.public.v1","sha256":"8f077eab4dd44221187ee9e273e175fce19ba84d7a999623d50700b004ee511d"},{"artifact_type":"market_brief_public_projection","byte_length":1788,"filename":"brief.json","logical_name":"Brief 001 public Market Brief projection","mime_type":"application/json","schema":"hgd.market_brief.public.v2","sha256":"677d5211e60f4fe4f87db6ca31d35a0ba76aca7ce50bda307a6477531cf74d5b"}],"canonical_product_id":"hgd-weekly-record-2026-07-17","canonical_publication_at":"2026-07-18T17:32:11Z","chain_position":0,"citation_id":"HGD CMD-001","genesis":true,"hash_algorithm":"sha256","integrity_registration_at":"2026-08-02T22:05:23Z","previous_manifest_sha256":null,"publication_id":"hgd:cmd:001","registration_type":"RETROACTIVE_AFTER_PUBLIC_RELEASE","schema":"hgd.integrity.manifest.v1","series":"HGD_CMD","status":"ACTIVE","supersedes_manifest_sha256":null,"web_release_status_at_registration":"PUBLICLY_RELEASED_BEFORE_INTEGRITY_REGISTRATION"}