{"artifacts":[{"artifact_type":"cmd_public_projection","byte_length":2240,"filename":"record.json","logical_name":"HGD CMD-002 public CMD projection","mime_type":"application/json","schema":"hgd.cmd.public.v1","sha256":"e83fb6214e72b54f2c838a7f44b879bfad1b88dc7a510c879634d7f3974df67e"},{"artifact_type":"market_brief_public_projection","byte_length":1767,"filename":"brief.json","logical_name":"Brief 002 public Market Brief projection","mime_type":"application/json","schema":"hgd.market_brief.public.v2","sha256":"ab67267d75b858dce74df720ea7b76a1de5d782a5bcd03ca25de6aa853a8600a"}],"canonical_product_id":"hgd-weekly-record-2026-07-31","canonical_publication_at":"2026-08-01T00:35:59Z","chain_position":1,"citation_id":"HGD CMD-002","genesis":false,"hash_algorithm":"sha256","integrity_registration_at":"2026-08-02T22:05:23Z","previous_manifest_sha256":"7e30197cad2fb7700543aa93a0709b67238e994050db9dc6f184a713c0296d58","publication_id":"hgd:cmd:002","registration_type":"PRE_PUBLIC_WEB_RELEASE_INITIAL_REGISTRATION","schema":"hgd.integrity.manifest.v1","series":"HGD_CMD","status":"ACTIVE","supersedes_manifest_sha256":null,"web_release_status_at_registration":"NOT_YET_RELEASED"}